{
  "code": "EDITING_TOOL_IN_METADATA",
  "severity": "medium",
  "reason": "Producer metadata names an image editing application.",
  "evidence": {
    "page": 1,
    "bbox_norm": [0.1, 0.2, 0.4, 0.25],
    "bbox_precision": "block",
    "artifact_uri": "derived/9f2c91a0/v1/p1_ela.png",
    "value": "Adobe Photoshop 25.1"
  },
  "advisory": true,
  "requires_human_review": true,
  "detector": {
    "name": "pdf_metadata",
    "version": "4.0.0"
  },
  "simulated": false
}
